{
  "schema_version": "1.0",
  "task_id": "retired-mans-guide-ref-page-diagnostic-generate",
  "book_id": "retired-mans-guide",
  "type": "layout_reference",
  "stage": "visual_development",
  "summary": "Create visual reference: Diagram / checklist / test page example",
  "instructions": "The structured-content page family.\n\nRead style/visual-bible.md first and follow it exactly.\nNo text of any kind inside the artwork - typography is set by the deterministic renderer, never generated.\nSave the result as a draft, then submit it.\n\nFixed at intake - do not change without the operator:\n- Title: exactly \"The Newly Retired Man's Guide to Being Home All Day\"\n- Main character: Graham, 66, just retired after 41 years as a regional operations manager, married to Sue, 63, who has run the house the whole time. Two grown-up children and one grandchild, Ellie, 3. Fixed look: reading glasses pushed up on his forehead, a zip-up fleece gilet, and a tape measure clipped to his belt.\n- Print colour: black and white\n- Cover style: a picture cover\n- Must avoid: Anything about money worries, health decline or death; keep it warm, not patronising.",
  "page_id": null,
  "asset_id": "ref-page-diagnostic",
  "scene": null,
  "characters": [],
  "references": [],
  "required_inputs": [
    "style/visual-bible.md",
    "style/design-tokens.json"
  ],
  "constraints": {
    "embedded_text": false,
    "maintain_character_identity": true,
    "maintain_style": true,
    "colour": false,
    "readable_image": true,
    "min_pixels": 1530
  },
  "output": {
    "destination": "assets/drafts/ref-page-diagnostic/",
    "submit_command": "bookfactory submit retired-mans-guide ref-page-diagnostic --kind asset --file <path>",
    "expected_format": "png"
  },
  "approval_required": true,
  "status": "done",
  "gate": null,
  "remediation": false,
  "retry_count": 0,
  "mode": "continue_automatically",
  "created_at": "2026-10-02T11:19:32Z",
  "closed_at": "2026-10-02T11:20:50Z"
}
