{
  "schema_version": "1.0",
  "task_id": "padel-addicts-guide-p035-approve",
  "book_id": "padel-addicts-guide",
  "type": "approval",
  "stage": "page_production",
  "summary": "Approve page p035 - The 6am group chat",
  "instructions": "Draft v1 of p035 is waiting for an explicit decision.\nFile: pages/drafts/p035/p035-v1.pdf\n\nNothing is approved by silence. Approve or reject explicitly:\n  bookfactory approve padel-addicts-guide p035 --kind page --draft v1\n  bookfactory reject padel-addicts-guide p035 --kind page --draft v1 --reason \"...\"",
  "page_id": "p035",
  "asset_id": null,
  "scene": null,
  "characters": [],
  "references": [],
  "required_inputs": [],
  "constraints": {},
  "output": {},
  "approval_required": true,
  "status": "done",
  "gate": null,
  "remediation": false,
  "retry_count": 0,
  "mode": "continue_automatically",
  "created_at": "2026-09-26T16:03:32Z",
  "closed_at": "2026-09-26T16:03:32Z"
}
