{
  "schema_version": "1.0",
  "task_id": "golf-addicts-guide-to-family-reintegration-p057-approve",
  "book_id": "golf-addicts-guide-to-family-reintegration",
  "type": "approval",
  "stage": "page_production",
  "summary": "Approve page p057 - Early warning signs this week",
  "instructions": "Draft v1 of p057 is waiting for an explicit decision.\nFile: pages/drafts/p057/p057-v1.pdf\n\nNothing is approved by silence. Approve or reject explicitly:\n  bookfactory approve golf-addicts-guide-to-family-reintegration p057 --kind page --draft v1\n  bookfactory reject golf-addicts-guide-to-family-reintegration p057 --kind page --draft v1 --reason \"...\"",
  "page_id": "p057",
  "asset_id": null,
  "scene": null,
  "characters": [],
  "references": [],
  "required_inputs": [],
  "constraints": {},
  "output": {},
  "approval_required": true,
  "status": "done",
  "gate": null,
  "remediation": false,
  "retry_count": 0,
  "mode": "continue_automatically",
  "created_at": "2026-09-24T10:56:08Z",
  "closed_at": "2026-09-24T10:56:08Z"
}
