{
  "schema_version": "1.0",
  "task_id": "padel-addicts-guide-p023-render",
  "book_id": "padel-addicts-guide",
  "type": "page_render",
  "stage": "page_production",
  "summary": "Render page p023 - How a question works",
  "instructions": "Render the page deterministically from its spec and its approved artwork. No generative step is involved: all typography, page numbers and structured content are set by the renderer.\n\nRun: bookfactory render padel-addicts-guide --page p023 --submit",
  "page_id": "p023",
  "asset_id": null,
  "scene": null,
  "characters": [],
  "references": [],
  "required_inputs": [
    "pages/specs/p023.json"
  ],
  "constraints": {},
  "output": {
    "destination": "pages/drafts/p023/",
    "submit_command": "bookfactory submit padel-addicts-guide p023 --kind page --file <path>",
    "expected_format": "pdf"
  },
  "approval_required": true,
  "status": "done",
  "gate": null,
  "remediation": false,
  "retry_count": 0,
  "mode": "continue_automatically",
  "created_at": "2026-09-26T16:03:16Z",
  "closed_at": "2026-09-26T16:03:16Z"
}
