{
  "schema_version": "1.0",
  "task_id": "demo-book-p007-approve",
  "book_id": "demo-book",
  "type": "approval",
  "stage": "page_production",
  "summary": "Approve page p007 - The window observation",
  "instructions": "Draft v1 of p007 is waiting for an explicit decision.\nFile: pages/drafts/p007/p007-v1.pdf\n\nNothing is approved by silence. Approve or reject explicitly:\n  bookfactory approve demo-book p007 --kind page --draft v1\n  bookfactory reject demo-book p007 --kind page --draft v1 --reason \"...\"",
  "page_id": "p007",
  "asset_id": null,
  "scene": null,
  "characters": [],
  "references": [],
  "required_inputs": [],
  "constraints": {},
  "output": {},
  "approval_required": true,
  "status": "done",
  "created_at": "2026-09-18T12:47:50Z",
  "closed_at": "2026-09-18T12:47:50Z"
}
