{
  "schema_version": "1.0",
  "task_id": "golf-addicts-guide-to-family-reintegration-art-stage-05-opener-illustration",
  "book_id": "golf-addicts-guide-to-family-reintegration",
  "type": "illustration",
  "stage": "page_production",
  "summary": "Create illustration 'art-stage-05-opener' for page p038",
  "instructions": "A family wedding photograph on church steps, everyone in their best clothes and smiling, Alfie as a page boy and Poppy as a flower girl, and Dave at the end of the row in a suit, cap on, with a golf umbrella in his hand and one eye on the sky.\n\nMatch the locked references exactly - same character, same line style, same palette, same edge treatment. If you cannot match them, stop and say so rather than producing something near enough.\nNo text, numbers, labels or signatures inside the artwork.",
  "page_id": "p038",
  "asset_id": "art-stage-05-opener",
  "scene": "A family wedding photograph on church steps, everyone in their best clothes and smiling, Alfie as a page boy and Poppy as a flower girl, and Dave at the end of the row in a suit, cap on, with a golf umbrella in his hand and one eye on the sky.",
  "characters": [
    "dave",
    "sue",
    "alfie",
    "poppy",
    "biscuit"
  ],
  "references": [
    "assets/approved/ref-character-main-main-character-reference.png",
    "assets/approved/ref-character-support-supporting-characters-sue-alfie-poppy-and-biscuit.png",
    "assets/approved/ref-page-editorial-editorial-illustration-example-stage-one-doorstep-scene.png"
  ],
  "required_inputs": [
    "pages/specs/p038.json",
    "style/visual-bible.md"
  ],
  "constraints": {
    "embedded_text": false,
    "maintain_character_identity": true,
    "maintain_style": true,
    "colour": false,
    "readable_image": true,
    "min_pixels": 1080
  },
  "output": {
    "destination": "assets/drafts/art-stage-05-opener/",
    "submit_command": "bookfactory submit golf-addicts-guide-to-family-reintegration art-stage-05-opener --kind asset --file <path>",
    "expected_format": "png"
  },
  "approval_required": true,
  "status": "open",
  "gate": null,
  "remediation": false,
  "retry_count": 0,
  "mode": "continue_automatically",
  "created_at": "2026-09-24T10:55:03Z",
  "closed_at": null
}
