{
  "schema_version": "1.0",
  "task_id": "padel-addicts-guide-ref-layout-chapter-opener-register",
  "book_id": "padel-addicts-guide",
  "type": "authoring",
  "stage": "visual_development",
  "summary": "Register required visual reference 'ref-layout-chapter-opener'",
  "instructions": "The reference set requires 'ref-layout-chapter-opener' (Chapter opener example) but it is not in the asset registry.\n\nRun: bookfactory asset add padel-addicts-guide ref-layout-chapter-opener --kind layout_reference --title 'Chapter opener example'",
  "page_id": null,
  "asset_id": "ref-layout-chapter-opener",
  "scene": null,
  "characters": [],
  "references": [],
  "required_inputs": [],
  "constraints": {},
  "output": {},
  "approval_required": false,
  "status": "done",
  "gate": null,
  "remediation": false,
  "retry_count": 0,
  "mode": "continue_automatically",
  "created_at": "2026-09-26T13:26:19Z",
  "closed_at": "2026-09-26T13:26:19Z"
}
