{
  "schema_version": "1.0",
  "task_id": "demo-book-p014-render",
  "book_id": "demo-book",
  "type": "page_render",
  "stage": "page_production",
  "summary": "Render page p014 - Principles of response",
  "instructions": "Render the page deterministically from its spec and its approved artwork. No generative step is involved: all typography, page numbers and structured content are set by the renderer.\n\nRun: bookfactory render demo-book --page p014 --submit",
  "page_id": "p014",
  "asset_id": null,
  "scene": null,
  "characters": [],
  "references": [],
  "required_inputs": [
    "pages/specs/p014.json",
    "assets/approved/p014-principles-principles-of-response.png"
  ],
  "constraints": {},
  "output": {
    "destination": "pages/drafts/p014/",
    "submit_command": "bookfactory submit demo-book p014 --kind page --file <path>",
    "expected_format": "pdf"
  },
  "approval_required": true,
  "status": "done",
  "created_at": "2026-09-18T16:28:46Z",
  "closed_at": "2026-09-18T16:28:46Z"
}
