{
  "schema_version": "1.0",
  "task_id": "runners-guide-to-normal-conversation-brief",
  "book_id": "runners-guide-to-normal-conversation",
  "type": "authoring",
  "stage": "book_brief",
  "summary": "Complete the book brief",
  "instructions": "Fill in brief/brief.md. Every TODO must be replaced with a real answer.\nThe recognition triggers matter most - they are what the buyer is paying for.\nAlso fill brief/concept.md and brief/audience.md.\n\nBlocking: brief/brief.md still contains TODO/TBD placeholders",
  "page_id": null,
  "asset_id": null,
  "scene": null,
  "characters": [],
  "references": [],
  "required_inputs": [
    "brief/brief.md"
  ],
  "constraints": {},
  "output": {
    "destination": "brief/",
    "submit_command": "bookfactory lock concept runners-guide-to-normal-conversation",
    "expected_format": "markdown"
  },
  "approval_required": true,
  "status": "open",
  "gate": null,
  "remediation": false,
  "retry_count": 0,
  "mode": "continue_automatically",
  "created_at": "2026-09-19T15:39:25Z",
  "closed_at": null
}
