{
  "schema_version": "1.0",
  "task_id": "golf-addicts-guide-to-family-reintegration-visual-bible",
  "book_id": "golf-addicts-guide-to-family-reintegration",
  "type": "authoring",
  "stage": "manuscript_lock",
  "summary": "Finish the visual bible",
  "instructions": "Replace every TODO in style/visual-bible.md. Be concrete about character appearance, line style, medium, palette and edge treatment.\nA fresh agent with no chat history must be able to draw on-style from this file alone. Vague entries here are what caused the drift last time.",
  "page_id": null,
  "asset_id": null,
  "scene": null,
  "characters": [],
  "references": [],
  "required_inputs": [
    "brief/brief.md",
    "style/design-tokens.json"
  ],
  "constraints": {},
  "output": {
    "destination": "style/visual-bible.md",
    "expected_format": "markdown"
  },
  "approval_required": true,
  "status": "open",
  "gate": null,
  "remediation": false,
  "retry_count": 0,
  "mode": "continue_automatically",
  "created_at": "2026-09-23T21:22:14Z",
  "closed_at": null
}
