{
  "schema_version": "1.0",
  "task_id": "padel-addicts-guide-assemble",
  "book_id": "padel-addicts-guide",
  "type": "assembly",
  "stage": "release_ready",
  "summary": "Assemble the interior PDF",
  "instructions": "Assembly is mechanical: approved pages, in manifest order, checksums verified. It never regenerates, rewrites or reinterprets anything.\n\nRun: bookfactory assemble padel-addicts-guide",
  "page_id": null,
  "asset_id": null,
  "scene": null,
  "characters": [],
  "references": [],
  "required_inputs": [],
  "constraints": {},
  "output": {},
  "approval_required": false,
  "status": "done",
  "gate": null,
  "remediation": false,
  "retry_count": 0,
  "mode": "continue_automatically",
  "created_at": "2026-09-27T20:21:17Z",
  "closed_at": "2026-09-27T20:22:15Z"
}
