{
  "schema_version": "1.0",
  "task_id": "padel-addicts-guide-ref-character-support-register",
  "book_id": "padel-addicts-guide",
  "type": "authoring",
  "stage": "visual_development",
  "summary": "Register required visual reference 'ref-character-support'",
  "instructions": "The reference set requires 'ref-character-support' (Supporting character reference) but it is not in the asset registry.\n\nRun: bookfactory asset add padel-addicts-guide ref-character-support --kind character_reference --title 'Supporting character reference'",
  "page_id": null,
  "asset_id": "ref-character-support",
  "scene": null,
  "characters": [],
  "references": [],
  "required_inputs": [],
  "constraints": {},
  "output": {},
  "approval_required": false,
  "status": "done",
  "gate": null,
  "remediation": false,
  "retry_count": 0,
  "mode": "continue_automatically",
  "created_at": "2026-09-26T12:07:41Z",
  "closed_at": "2026-09-26T12:07:48Z"
}
