{
  "schema_version": "1.0",
  "task_id": "padel-addicts-guide-cover-register",
  "book_id": "padel-addicts-guide",
  "type": "authoring",
  "stage": "release_ready",
  "summary": "Register cover-front-artwork with locked references",
  "instructions": "Register as cover_artwork with references ['assets/approved/ref-character-main-main-character-reference.png', 'assets/approved/ref-character-support-supporting-character-reference.png', 'assets/approved/ref-layout-chapter-opener-chapter-opener-example.png', 'assets/approved/ref-page-editorial-editorial-illustration-example-phase-one-kitchen-table-scene.png', 'assets/approved/ref-page-diagnostic-activity-page-example-no-01-current-state-assessment.png', 'assets/approved/ref-palette-palette-and-type-sheet.png'].",
  "page_id": null,
  "asset_id": null,
  "scene": null,
  "characters": [],
  "references": [],
  "required_inputs": [],
  "constraints": {},
  "output": {},
  "approval_required": false,
  "status": "open",
  "gate": null,
  "remediation": false,
  "retry_count": 0,
  "mode": "continue_automatically",
  "created_at": "2026-09-27T20:22:34Z",
  "closed_at": null
}
