{
  "schema_version": "1.0",
  "task_id": "padel-addicts-guide-art-phase-02-opener-illustration",
  "book_id": "padel-addicts-guide",
  "type": "illustration",
  "stage": "page_production",
  "summary": "Create illustration 'art-phase-02-opener' for page p014",
  "instructions": "Josh in pyjama bottoms and a padel quarter-zip in a dark kitchen at dawn, lit by his phone, thumbing the group chat with a grin, while a baby monitor on the counter shows Alfie standing up in his cot and wailing.\n\nMatch the locked references exactly - same character, same line style, same palette, same edge treatment. If you cannot match them, stop and say so rather than producing something near enough.\nNo text, numbers, labels or signatures inside the artwork.",
  "page_id": "p014",
  "asset_id": "art-phase-02-opener",
  "scene": "Josh in pyjama bottoms and a padel quarter-zip in a dark kitchen at dawn, lit by his phone, thumbing the group chat with a grin, while a baby monitor on the counter shows Alfie standing up in his cot and wailing.",
  "characters": [],
  "references": [
    "assets/approved/ref-character-main-main-character-reference.png",
    "assets/approved/ref-character-support-supporting-character-reference.png",
    "assets/approved/ref-layout-chapter-opener-chapter-opener-example.png",
    "assets/approved/ref-page-editorial-editorial-illustration-example-phase-one-kitchen-table-scene.png",
    "assets/approved/ref-page-diagnostic-activity-page-example-no-01-current-state-assessment.png",
    "assets/approved/ref-palette-palette-and-type-sheet.png"
  ],
  "required_inputs": [
    "pages/specs/p014.json",
    "style/visual-bible.md"
  ],
  "constraints": {
    "embedded_text": false,
    "maintain_character_identity": true,
    "maintain_style": true,
    "colour": false,
    "readable_image": true,
    "min_pixels": 1080
  },
  "output": {
    "destination": "assets/drafts/art-phase-02-opener/",
    "submit_command": "bookfactory submit padel-addicts-guide art-phase-02-opener --kind asset --file <path>",
    "expected_format": "png"
  },
  "approval_required": true,
  "status": "open",
  "gate": null,
  "remediation": false,
  "retry_count": 0,
  "mode": "continue_automatically",
  "created_at": "2026-09-26T15:59:57Z",
  "closed_at": null
}
