{
  "schema_version": "1.0",
  "task_id": "padel-addicts-guide-brief",
  "book_id": "padel-addicts-guide",
  "type": "authoring",
  "stage": "book_brief",
  "summary": "Complete the book brief",
  "instructions": "Fill in brief/brief.md. Every TODO must be replaced with a real answer.\nThe recognition triggers matter most - they are what the buyer is paying for.\nAlso fill brief/concept.md and brief/audience.md.\n\nBlocking: brief/brief.md still contains TODO/TBD placeholders\n\nFixed at intake - do not change without the operator:\n- Title: exactly \"The Padel Addict's Guide to Talking About Anything Else\"\n- Main character: Josh, 31, a management consultant, married to Lauren, two children under five (Mia, 4, and Alfie, 1). Fixed look: short beard, a smartwatch he never takes off, and a padel brand cap or quarter-zip whether he is at the office or a toddler's birthday party.\n- Print colour: black and white\n- Cover style: big lettering (a text-only cover, bold type, no picture)",
  "page_id": null,
  "asset_id": null,
  "scene": null,
  "characters": [],
  "references": [],
  "required_inputs": [
    "brief/brief.md"
  ],
  "constraints": {},
  "output": {
    "destination": "brief/",
    "submit_command": "bookfactory lock concept padel-addicts-guide",
    "expected_format": "markdown"
  },
  "approval_required": true,
  "status": "open",
  "gate": null,
  "remediation": false,
  "retry_count": 0,
  "mode": "continue_automatically",
  "created_at": "2026-09-26T10:55:07Z",
  "closed_at": null
}
