{
  "schema_version": "1.0",
  "task_id": "runners-guide-to-normal-conversation-ref-palette-approve",
  "book_id": "runners-guide-to-normal-conversation",
  "type": "approval",
  "stage": "visual_development",
  "summary": "Review reference artwork 'ref-palette'",
  "instructions": "Draft v1 of ref-palette is waiting for an explicit decision.\nFile: assets/drafts/ref-palette/ref-palette-v1.png\n\nNothing is approved by silence. Approve or reject explicitly:\n  bookfactory approve runners-guide-to-normal-conversation ref-palette --kind asset --draft v1\n  bookfactory reject runners-guide-to-normal-conversation ref-palette --kind asset --draft v1 --reason \"...\"",
  "page_id": null,
  "asset_id": "ref-palette",
  "scene": null,
  "characters": [],
  "references": [],
  "required_inputs": [],
  "constraints": {},
  "output": {},
  "approval_required": true,
  "status": "done",
  "gate": null,
  "remediation": false,
  "retry_count": 0,
  "mode": "wait_for_operator",
  "created_at": "2026-09-20T09:28:57Z",
  "closed_at": "2026-09-20T09:29:08Z"
}
