{
  "schema_version": "1.0",
  "task_id": "padel-addicts-guide-qa",
  "book_id": "padel-addicts-guide",
  "type": "qa",
  "stage": "page_approval",
  "summary": "Run QA across the book",
  "instructions": "Every page is approved and QA has not been run.\n\nRun: bookfactory qa padel-addicts-guide\n\nContent, visual and technical layers run together. Findings marked 'needs_human' cannot be decided by a machine - a person or an agent has to look at the pages.",
  "page_id": null,
  "asset_id": null,
  "scene": null,
  "characters": [],
  "references": [],
  "required_inputs": [],
  "constraints": {},
  "output": {},
  "approval_required": false,
  "status": "done",
  "gate": null,
  "remediation": false,
  "retry_count": 0,
  "mode": "continue_automatically",
  "created_at": "2026-09-26T16:05:11Z",
  "closed_at": "2026-09-26T16:05:15Z"
}
