{
  "schema_version": "1.0",
  "task_id": "padel-addicts-guide-cover-preflight",
  "book_id": "padel-addicts-guide",
  "type": "preflight",
  "stage": "release_ready",
  "summary": "Preflight the approved KDP full-wrap cover",
  "instructions": "Run bookfactory cover preflight padel-addicts-guide.",
  "page_id": null,
  "asset_id": null,
  "scene": null,
  "characters": [],
  "references": [],
  "required_inputs": [],
  "constraints": {},
  "output": {},
  "approval_required": false,
  "status": "done",
  "gate": null,
  "remediation": false,
  "retry_count": 0,
  "mode": "continue_automatically",
  "created_at": "2026-09-27T20:33:43Z",
  "closed_at": "2026-09-27T20:34:01Z"
}
