{
  "schema_version": "1.0",
  "task_id": "golf-addicts-guide-to-family-reintegration-art-stage-08-opener-approve",
  "book_id": "golf-addicts-guide-to-family-reintegration",
  "type": "approval",
  "stage": "page_production",
  "summary": "Review artwork 'art-stage-08-opener' for page p063",
  "instructions": "Draft v1 of art-stage-08-opener is waiting for an explicit decision.\nFile: assets/drafts/art-stage-08-opener/art-stage-08-opener-v1.png\n\nNothing is approved by silence. Approve or reject explicitly:\n  bookfactory approve golf-addicts-guide-to-family-reintegration art-stage-08-opener --kind asset --draft v1\n  bookfactory reject golf-addicts-guide-to-family-reintegration art-stage-08-opener --kind asset --draft v1 --reason \"...\"",
  "page_id": null,
  "asset_id": "art-stage-08-opener",
  "scene": null,
  "characters": [],
  "references": [],
  "required_inputs": [],
  "constraints": {},
  "output": {},
  "approval_required": true,
  "status": "done",
  "gate": null,
  "remediation": false,
  "retry_count": 0,
  "mode": "continue_automatically",
  "created_at": "2026-09-24T10:56:11Z",
  "closed_at": "2026-09-24T10:56:11Z"
}
